{"alternates":null,"baseBranch":"main","baseSha":"aaaaaaaaaaaaaaaaaaaaaaaaaaaaaaaaaaaaaaaa","featureBranch":"squire/aidev-222-run_example01","gitCommonDir":"/ticket/git/repo.git","headSha":"bbbbbbbbbbbbbbbbbbbbbbbbbbbbbbbbbbbbbbbb","hooksPath":"/ticket/control/git/run_example01/hooks","kind":"squire-git-workspace-manifest","objectDirectory":"/ticket/git/repo.git/objects","objectFormat":"sha1","repository":{"cloneUrl":"https://github.com/example/service.git","name":"service","owner":"example"},"resources":{"alternates":null,"artifactRoot":{"device":"1","inode":"8","kind":"directory","linkCount":2,"mode":448,"path":"/ticket/artifacts/git/run_example01"},"config":{"device":"1","inode":"5","kind":"file","linkCount":1,"mode":420,"path":"/ticket/git/repo.git/config"},"controlRoot":{"device":"1","inode":"9","kind":"directory","linkCount":3,"mode":448,"path":"/ticket/control/git/run_example01"},"hooks":{"device":"1","inode":"6","kind":"directory","linkCount":2,"mode":448,"path":"/ticket/control/git/run_example01/hooks"},"objects":{"device":"1","inode":"7","kind":"directory","linkCount":5,"mode":493,"path":"/ticket/git/repo.git/objects"},"repository":{"device":"1","inode":"2","kind":"directory","linkCount":5,"mode":493,"path":"/ticket/git/repo.git"},"worktree":{"device":"1","inode":"3","kind":"directory","linkCount":2,"mode":493,"path":"/ticket/workspace"},"worktreeGitDir":{"device":"1","inode":"4","kind":"directory","linkCount":3,"mode":493,"path":"/ticket/git/repo.git/worktrees/workspace"}},"runId":"run_example01","safeConfigDigest":"dddddddddddddddddddddddddddddddddddddddddddddddddddddddddddddddd","schemaVersion":1,"spec":{"path":"artifacts/git/run_example01/workspace-spec.json","schemaId":"urn:squire:git-workspace:v1:workspace-spec","sha256":"cccccccccccccccccccccccccccccccccccccccccccccccccccccccccccccccc"},"specFingerprint":"bea46605affd9cff7d3911bfb72bd696e1aa53f8d0f27b989307cd79c32ddfa6","ticketIdentifier":"AIDEV-222","verifiedAt":"2026-09-01T00:00:00.000Z","verifierVersion":"aidev-222-git-verifier-v1.0","worktree":"/ticket/workspace","worktreeCount":1,"worktreeGitDir":"/ticket/git/repo.git/worktrees/workspace"}
